{
  "$schema": "https://json-schema.org/draft/2020-12/schema",
  "$id": "https://napkin.ie/production-tool/contracts/config.schema.json",
  "title": "Remote config (config.json on S3 behind CloudFront)",
  "description": "Read by the web app at load and every 2 minutes, and by the relay on every job (cached 30 s). Changing it is uploading a file; no deploy. It is public: never put keys or handles in it. Provider keys live in Secrets Manager and the blocked list in the relay's DynamoDB table.",
  "type": "object",
  "properties": {
    "contractVersion": { "$ref": "common.schema.json#/$defs/contractVersion" },
    "routing": {
      "type": "object",
      "description": "Per op, providers in order of preference. The relay sends a job to the first one whose capability sheet supports the op and that has a free slot; the UI shows controls from the first provider's sheet. An empty list turns the op off. When an op routes to runway, Runway is the floor of every job for it, picks included: a job that fails on another provider for a provider or account reason is made again once on Runway's default model (features/runway-fallback.clan).",
      "propertyNames": { "$ref": "common.schema.json#/$defs/op" },
      "additionalProperties": { "type": "array", "items": { "$ref": "common.schema.json#/$defs/provider" }, "uniqueItems": true }
    },
    "director": {
      "type": "object",
      "properties": {
        "promptVersion": { "type": "string", "pattern": "^director\\.v[0-9]+(\\.[0-9]+)?$" },
        "perClickModel": { "type": "string" },
        "shotListModel": { "type": "string" }
      },
      "required": ["promptVersion", "perClickModel", "shotListModel"],
      "additionalProperties": false
    },
    "quotas": {
      "type": "object",
      "description": "Per person per day.",
      "properties": {
        "image": { "type": "integer", "minimum": 0 },
        "video": { "type": "integer", "minimum": 0 },
        "render": { "type": "integer", "minimum": 0 }
      },
      "required": ["image", "video", "render"],
      "additionalProperties": false
    },
    "inFlightPerParticipant": { "type": "integer", "minimum": 1, "maximum": 6 },
    "jobTimeoutS": {
      "type": "object",
      "properties": { "image": { "type": "integer" }, "video": { "type": "integer" } },
      "required": ["image", "video"],
      "additionalProperties": false
    },
    "queueTimeoutS": {
      "type": "object",
      "description": "How long a job may wait in the queue for a free provider slot before it fails, per class (seconds). Optional: absent, the relay uses 1800 for image and video. jobTimeoutS still bounds a job once it runs.",
      "properties": { "image": { "type": "integer", "minimum": 60 }, "video": { "type": "integer", "minimum": 60 } },
      "required": ["image", "video"],
      "additionalProperties": false
    },
    "spend": {
      "type": "object",
      "properties": {
        "capUsd": { "type": "number", "minimum": 0, "description": "Global stop: new paid jobs are refused with spend_stop once confirmed + reserved reaches it." },
        "warnUsd": { "type": "number", "minimum": 0 }
      },
      "required": ["capUsd", "warnUsd"],
      "additionalProperties": false
    },
    "flags": {
      "type": "object",
      "description": "Kill switches and the D7 go/no-go flags. A control appears only when its flag is on AND the routed provider's sheet supports it.",
      "properties": {
        "storyboard": { "type": "boolean" },
        "video": { "type": "boolean" },
        "stitch": { "type": "boolean" },
        "regionEditFrames": { "type": "boolean" },
        "regionEditCanvas": { "type": "boolean" },
        "videoRegionEdit": { "type": "boolean" },
        "feelEdit": { "type": "boolean" },
        "clickSelect": { "type": "boolean" },
        "moreOptions": { "type": "boolean", "description": "Ask for 4 variants instead of 1." },
        "dogfood": { "type": "boolean", "description": "The beta's record (features/production-tool-dogfood.clan): the notice, the Beta tag and the thumbs in the web app, and POST /dogfood/* on the relay. Optional; absent means off." },
        "clipPatch": { "type": "boolean", "description": "Fix this moment (features/clip-moment-edit.clan): op clip_patch regenerates only a note's window and splices it back. Optional; absent means off (clip_patch answers flag_off). Separate from videoRegionEdit, which also unlocks boxed Aleph region edits." },
        "connectedVideo": { "type": "boolean", "description": "Connected video (features/connected-video.clan): How shots join (As one film), run planning, takes over several shots, landing frames, Remake just this shot; and on the relay, a clip's mode, lastFrame, cuts and redo window (refused flag_off without it). Optional; absent means off: Make clips sends each shot alone, as before." },
        "ownCanvas": { "type": "boolean", "description": "Our own canvas engine (features/canvas-engine.clan) for new projects, in place of Excalidraw. Optional; absent means off. A person can also ask for it with ?engine=own. A saved scene always opens in the engine that made it." }
      },
      "required": ["storyboard", "video", "stitch", "regionEditFrames", "regionEditCanvas", "videoRegionEdit", "feelEdit", "clickSelect", "moreOptions"],
      "additionalProperties": false
    },
    "banner": { "type": "string", "maxLength": 200 },
    "clipPatch": {
      "type": "object",
      "description": "Fix this moment's settings (features/clip-moment-edit.clan). Optional, every key too: absent means the defaults shown. model: which of the sheet's clip_patch models makes the window (aleph2; an alternate such as veo3.1 once it is on the sheet), chosen before the job runs. contextS: whole seconds of the take cut each side of the window and sent with it (0 keeps the price at the window's; 1 is an eval variant). crossfadeS: each seam's crossfade, inside the window. seamMin: Jude's relative-SSIM line for a seam; below it the take still lands, with his warning.",
      "properties": {
        "model": { "type": "string", "minLength": 1, "maxLength": 120 },
        "send": { "enum": ["range", "cut"], "description": "range (the default): the whole take goes to Aleph 2 with the window as its keyframe's range, which Aleph edits and bills alone (pathway tests 2026-10-13). cut: only the window (plus contextS) is cut out and sent. A take longer than Aleph takes is always cut." },
        "contextS": { "type": "integer", "minimum": 0, "maximum": 2 },
        "crossfadeS": { "type": "number", "minimum": 0, "maximum": 1 },
        "seamMin": { "type": "number", "minimum": 0, "maximum": 1 }
      },
      "additionalProperties": false
    }
  },
  "required": ["contractVersion", "routing", "director", "quotas", "inFlightPerParticipant", "jobTimeoutS", "spend", "flags", "banner"],
  "additionalProperties": false
}
