{
  "contractVersion": "3",
  "routing": {
    "generate": ["runway"], "view": ["runway"], "shot_list": [],
    "frame": ["runway"], "region_edit": ["runway"], "frame_edit": ["runway"], "clip": ["runway"], "clip_edit": ["runway"], "clip_patch": ["runway"], "stitch": [],
    "upscale": ["runway"], "cutout": []
  },
  "director": { "promptVersion": "director.v8", "perClickModel": "eu.anthropic.claude-sonnet-5-5", "shotListModel": "eu.anthropic.claude-sonnet-5-5" },
  "quotas": { "image": 40, "video": 6, "render": 3 },
  "inFlightPerParticipant": 2,
  "jobTimeoutS": { "image": 180, "video": 600 },
  "spend": { "capUsd": 200, "warnUsd": 150 },
  "flags": { "storyboard": true, "video": true, "stitch": true, "regionEditFrames": true, "regionEditCanvas": false, "videoRegionEdit": false, "feelEdit": false, "clickSelect": false, "moreOptions": false, "clipPatch": false },
  "banner": "",
  "clipPatch": { "model": "aleph2", "send": "range", "contextS": 0, "crossfadeS": 0.25, "seamMin": 0.85 }
}
