{
  "contractVersion": "2",
  "routing": {
    "generate": ["runway"], "view": ["runway"], "shot_list": [],
    "frame": ["runway"], "region_edit": ["runway"], "clip": ["runway"], "clip_edit": ["runway"], "stitch": []
  },
  "director": { "promptVersion": "director.v5", "perClickModel": "eu.anthropic.claude-sonnet-5-5", "shotListModel": "eu.anthropic.claude-sonnet-5-5" },
  "quotas": { "image": 40, "video": 6, "render": 3 },
  "inFlightPerParticipant": 2,
  "jobTimeoutS": { "image": 180, "video": 600 },
  "spend": { "capUsd": 1300, "warnUsd": 1000 },
  "flags": { "storyboard": true, "video": true, "stitch": true, "regionEditFrames": true, "regionEditCanvas": false, "videoRegionEdit": false, "feelEdit": false, "clickSelect": true, "moreOptions": false },
  "banner": ""
}
